,beta,score,forwardPE,currentRatio,profitMargin,debtToEquity,returnOnEquity,longBusinessSummary
NVDA,1.636866,10,2,2,2,2,2,"NVIDIA Corporation provides graphics, and compute and networking solutions in the United States, Taiwan, China, and internationally. The company's Graphics segment offers GeForce GPUs for gaming and PCs, the GeForce NOW game streaming service and related infrastructure, and solutions for gaming platforms; Quadro/NVIDIA RTX GPUs for enterprise workstation graphics; vGPU software for cloud-based visual and virtual computing; automotive platforms for infotainment systems; and Omniverse software for building 3D designs and virtual worlds. Its Compute & Networking segment provides Data Center platforms and systems for AI, HPC, and accelerated computing; Mellanox networking and interconnect solutions; automotive AI Cockpit, autonomous driving development agreements, and autonomous vehicle solutions; cryptocurrency mining processors; Jetson for robotics and other embedded platforms; and NVIDIA AI Enterprise and other software. The company's products are used in gaming, professional visualization, datacenter, and automotive markets. NVIDIA Corporation sells its products to original equipment manufacturers, original device manufacturers, system builders, add-in board manufacturers, retailers/distributors, independent software vendors, Internet and cloud service providers, automotive manufacturers and tier-1 automotive suppliers, mapping companies, start-ups, and other ecosystem participants. It has a strategic collaboration with Kroger Co. NVIDIA Corporation was incorporated in 1993 and is headquartered in Santa Clara, California."
ANET,1.281396,10,2,2,2,2,2,"Arista Networks, Inc. develops, markets, and sells cloud networking solutions in the Americas, Europe, the Middle East, Africa, and the Asia-Pacific. The company's cloud networking solutions consist of extensible operating systems, a set of network applications, as well as gigabit Ethernet switching and routing platforms. It also provides post contract customer support services, such as technical support, hardware repair and parts replacement beyond standard warranty, bug fix, patch, and upgrade services. The company serves a range of industries comprising internet companies, service providers, financial services organizations, government agencies, media and entertainment companies, and others. It markets and sells its products through distributors, system integrators, value-added resellers, and original equipment manufacturer partners, as well as through its direct sales force. The company was formerly known as Arastra, Inc. and changed its name to Arista Networks, Inc. in October 2008. Arista Networks, Inc. was incorporated in 2004 and is headquartered in Santa Clara, California."
CSCO,0.962111,9,2,1,2,2,2,"Cisco Systems, Inc. designs, manufactures, and sells Internet Protocol based networking and other products related to the communications and information technology industry in the Americas, Europe, the Middle East, Africa, the Asia Pacific, Japan, and China. It provides infrastructure platforms, including networking technologies of switching, routing, wireless, and data center products that are designed to work together to deliver networking capabilities, and transport and/or store data. The company also offers collaboration products comprising unified communications, Cisco TelePresence, and conferencing, as well as the Internet of Things and analytics software. In addition, it provides security products, such as network security, cloud and email security, identity and access management, advanced threat protection, and unified threat management products. Further, the company offers a range of service and support options for its customers, including technical support and advanced services. It serves businesses of various sizes, public institutions, governments, and service providers. The company sells its products and services directly, as well as through systems integrators, service providers, other resellers, and distributors. Cisco Systems, Inc. has strategic alliances with other companies. Cisco Systems, Inc. was incorporated in 1984 and is headquartered in San Jose, California."
INTC,0.670923,9,2,1,2,2,2,"Intel Corporation engages in the design, manufacture, and sale of computer products and technologies worldwide. The company operates through CCG, DCG, IOTG, Mobileye, NSG, PSG, and All Other segments. It offers platform products, such as central processing units and chipsets, and system-on-chip and multichip packages; and non-platform or adjacent products, including accelerators, boards and systems, connectivity products, graphics, and memory and storage products. The company also provides high-performance compute solutions for targeted verticals and embedded applications for retail, industrial, and healthcare markets; and solutions for assisted and autonomous driving comprising compute platforms, computer vision and machine learning-based sensing, mapping and localization, driving policy, and active sensors. In addition, it offers workload-optimized platforms and related products for cloud service providers, enterprise and government, and communications service providers. The company serves original equipment manufacturers, original design manufacturers, and cloud service providers. Intel Corporation has a strategic partnership with MILA to develop and apply advances in artificial intelligence methods for enhancing the search in the space of drugs. The company was incorporated in 1968 and is headquartered in Santa Clara, California."
QCOM,1.223073,9,2,1,2,2,2,"QUALCOMM Incorporated engages in the development and commercialization of foundational technologies for the wireless industry worldwide. The company operates through three segments: Qualcomm CDMA Technologies (QCT); Qualcomm Technology Licensing (QTL); and Qualcomm Strategic Initiatives (QSI). The QCT segment develops and supplies integrated circuits and system software based on 3G/4G/5G and other technologies for use in wireless voice and data communications, networking, application processing, multimedia, and global positioning system products. The QTL segment grants licenses or provides rights to use portions of its intellectual property portfolio, which include various patent rights useful in the manufacture and sale of wireless products comprising products implementing CDMA2000, WCDMA,LTE and/or OFDMA-based 5G standards and their derivatives. The QSI segment invests in early-stage companies in various industries, including 5G, artificial intelligence, automotive, consumer, enterprise, cloud, and IoT, and investment for supporting the design and introduction of new products and services for voice and data communications, new industries, and applications. It also provides development, and other services and related products to the United States government agencies and their contractors. QUALCOMM Incorporated was incorpotared in 1985 and is headquartered in San Diego, California."
TXN,0.974031,9,1,2,2,2,2,"Texas Instruments Incorporated designs, manufactures, and sells semiconductors to electronics designers and manufacturers worldwide. It operates in two segments, Analog and Embedded Processing. The Analog segment offers power products to manage power requirements in various levels using battery-management solutions, DC/DC switching regulators, AC/DC and isolated controllers and converters, power switches, linear regulators, voltage supervisors, voltage references, and lighting products. This segment also provides signal chain products that sense, condition, and measure signals to allow information to be transferred or converted for further processing and control for use in end markets, including amplifiers, data converters, interface products, motor drives, clocks, and sensing products. The Embedded Processing segment offers microcontrollers that are used in electronic equipment; digital signal processors for mathematical computations; and applications processors for specific computing activity. This segment offers products for use in various markets, such as industrial, automotive, personal electronics, communications equipment, enterprise systems, and calculators and other. The company also provides DLP products primarily for use in projectors to create high-definition images; calculators; and application-specific integrated circuits. It markets and sells its semiconductor products through direct sales and distributors, as well as through its website. Texas Instruments Incorporated was founded in 1930 and is headquartered in Dallas, Texas."
AVGO,1.104725,9,2,2,2,1,2,"Broadcom Inc. designs, develops, and supplies various semiconductor devices with a focus on complex digital and mixed signal complementary metal oxide semiconductor based devices and analog III-V based products worldwide. The company operates in two segments, Semiconductor Solutions and Infrastructure Software. It provides set-top box system-on-chips (SoCs); cable, digital subscriber line, and passive optical networking central office/consumer premise equipment SoCs; wireless local area network access point SoCs; Ethernet switching and routing merchant silicon products; embedded processors and controllers; serializer/deserializer application specific integrated circuits; optical and copper, and physical layers; and fiber optic transmitter and receiver components. The company also offers RF front end modules, filters, and power amplifiers; Wi-Fi, Bluetooth, and global positioning system/global navigation satellite system SoCs; custom touch controllers; serial attached small computer system interface, and redundant array of independent disks controllers and adapters; peripheral component interconnect express switches; fiber channel host bus adapters; read channel based SoCs; custom flash controllers; preamplifiers; and optocouplers, industrial fiber optics, and motion control encoders and subsystems. Its products are used in various applications, including enterprise and data center networking, home connectivity, set-top boxes, broadband access, telecommunication equipment, smartphones and base stations, data center servers and storage systems, factory automation, power generation and alternative energy systems, and electronic displays. Broadcom Inc. was incorporated in 2018 and is headquartered in San Jose, California."
NXPI,1.420178,8,2,2,1,1,2,"NXP Semiconductors N.V. offers various semiconductor products. The company's product portfolio includes microcontrollers; application processors, including i.MX application processors, and i.MX 8 and 9 family of applications processors; communication processors; wireless connectivity solutions, such as near field communications, ultra-wideband, Bluetooth low-energy, Zigbee, and Wi-Fi and Wi-Fi/Bluetooth integrated SoCs; analog and interface devices; radio frequency power amplifiers; and security controllers, as well as semiconductor-based environmental and inertial sensors, including pressure, inertial, magnetic, and gyroscopic sensors. The company's product solutions are used in a range of applications, including automotive, industrial and Internet of Things, mobile, and communication infrastructure. The company markets its products to various original equipment manufacturers, contract manufacturers, and distributors. It operates in China, the Netherlands, the United States, Singapore, Germany, Japan, South Korea, Malaysia, and internationally. The company was formerly known as KASLION Acquisition B.V and changed its name to NXP Semiconductors N.V. in May 2010. NXP Semiconductors N.V. was incorporated in 2006 and is headquartered in Eindhoven, the Netherlands."
ADBE,1.108131,8,1,1,2,2,2,"Adobe Inc. operates as a diversified software company worldwide. It operates through three segments: Digital Media, Digital Experience, and Publishing and Advertising. The Digital Media segment offers products, services, and solutions that enable individuals, teams, and enterprises to create, publish, and promote content; and Document Cloud, a unified cloud-based document services platform. Its flagship product is Creative Cloud, a subscription service that allows members to access its creative products. This segment serves content creators, workers, marketers, educators, enthusiasts, communicators, and consumers. The Digital Experience segment provides an integrated platform and set of applications and services that enable brands and businesses to create, manage, execute, measure, monetize, and optimize customer experiences from analytics to commerce. This segment serves marketers, advertisers, agencies, publishers, merchandisers, merchants, web analysts, data scientists, developers, and executives across the C-suite. The Publishing and Advertising segment offers products and services, such as e-learning solutions, technical document publishing, web conferencing, document and forms platform, web application development, and high-end printing, as well as Advertising Cloud offerings. The company offers its products and services directly to enterprise customers through its sales force and local field offices, as well as to end users through app stores and through its website at adobe.com. It also distributes products and services through a network of distributors, value-added resellers, systems integrators, software vendors and developers, retailers, and original equipment manufacturers. The company was formerly known as Adobe Systems Incorporated and changed its name to Adobe Inc. in October 2018. Adobe Inc. was founded in 1982 and is headquartered in San Jose, California."
PYPL,1.433375,7,2,1,1,2,1,"PayPal Holdings, Inc. operates a technology platform that enables digital payments on behalf of merchants and consumers worldwide. It provides payment solutions under the PayPal, PayPal Credit, Braintree, Venmo, Xoom, Zettle, Hyperwallet, Honey, and Paidy names. The company's payments platform allows consumers to send and receive payments in approximately 200 markets and in approximately 100 currencies, withdraw funds to their bank accounts in 56 currencies, and hold balances in their PayPal accounts in 25 currencies. PayPal Holdings, Inc. was founded in 1998 and is headquartered in San Jose, California."
CTSH,1.106002,7,2,2,0,2,1,"Cognizant Technology Solutions Corporation, a professional services company, provides consulting and technology, and outsourcing services in North America, Europe, and internationally. It operates through four segments: Financial Services; Healthcare; Products and Resources; and Communications, Media and Technology. The company offers customer experience enhancement, robotic process automation, analytics, and AI services in areas, such as digital lending, fraud detection, and next generation payments; the shift towards consumerism, outcome-based contracting, digital health, delivering integrated seamless, omni-channel, and patient-centered experience; and services that drive operational improvements in areas, such as clinical development, pharmacovigilance, and manufacturing, as well as claims processing, enrollment, membership, and billing to healthcare providers and payers, and life sciences companies, including pharmaceutical, biotech, and medical device companies. It also provides solution to manufacturers, retailers and travel and hospitality companies, as well as companies providing logistics, energy and utility services; and digital content, the creation of personalized user experience, and acceleration of digital engineering services to information, media and entertainment, and communications and technology companies. The company was founded in 1994 and is headquartered in Teaneck, New Jersey."
TSM,1.102596,6,2,-1,2,2,-1,"Taiwan Semiconductor Manufacturing Company Limited manufactures, packages, tests, and sells integrated circuits and other semiconductor devices in Taiwan, China, Europe, the Middle East, Africa, Japan, the United States, and internationally. It provides complementary metal oxide silicon wafer fabrication processes to manufacture logic, mixed-signal, radio frequency, and embedded memory semiconductors. The company also offers customer support, account management, and engineering services, as well as manufactures masks. Its products are used in mobile devices, high performance computing, automotive electronics, and internet of things markets. The company was incorporated in 1987 and is headquartered in Hsinchu City, Taiwan."
ORCL,0.837803,6,2,1,1,-1,2,"Oracle Corporation offers products and services that address enterprise information technology environments worldwide. Its Oracle cloud software as a service offering include various cloud software applications, including Oracle Fusion cloud enterprise resource planning (ERP), Oracle Fusion cloud enterprise performance management, Oracle Fusion cloud supply chain and manufacturing management, Oracle Fusion cloud human capital management, Oracle Advertising, and NetSuite applications suite, as well as Oracle Fusion Sales, Service, and Marketing. The company also offers cloud-based industry solutions for various industries; Oracle application licenses; and Oracle license support services. In addition, it provides cloud and license business' infrastructure technologies, such as the Oracle Database, an enterprise database; Java, a software development language; and middleware, including development tools and others. The company's cloud and license business' infrastructure technologies also comprise cloud-based compute, storage, and networking capabilities; and Oracle autonomous database, MySQL HeatWave, Internet-of-Things, digital assistant, and blockchain. Further, it provides hardware products and other hardware-related software offerings, including Oracle engineered systems, enterprise servers, storage solutions, industry-specific hardware, virtualization software, operating systems, management software, and related hardware services; and consulting and customer services. The company markets and sells its cloud, license, hardware, support, and services offerings directly to businesses in various industries, government agencies, and educational institutions, as well as through indirect channels. Oracle Corporation was founded in 1977 and is headquartered in Austin, Texas."
FTNT,1.180928,6,2,1,1,0,2,"Fortinet, Inc. provides broad, integrated, and automated cybersecurity solutions in the Americas, Europe, the Middle East, Africa, and the Asia Pacific. It offers FortiGate hardware and software licenses that provide various security and networking functions, including firewall, intrusion prevention, anti-malware, virtual private network, application control, web filtering, anti-spam, and wide area network acceleration. The company also provides FortiSwitch product family that offers secure switching solutions for connecting customers their end devices; FortiAP product family, which provides secure wireless networking solutions; FortiExtender, a hardware appliance; FortiAnalyzer product family, which offers centralized network logging, analyzing, and reporting solutions; and FortiManager product family that provides central and scalable management solution for its FortiGate products. It offers FortiWeb product family provides web application firewall solutions; FortiMail product family that secure email gateway solutions; FortiSandbox technology that delivers proactive detection and mitigation services; FortiClient that provides endpoint protection with pattern-based anti-malware, behavior-based exploit protection, web-filtering, and an application firewall; FortiToken and FortiAuthenticator product families for multi-factor authentication to safeguard systems, assets, and data; and FortiEDR/XDR, an endpoint protection solution that provides both comprehensive machine-learning anti-malware execution and real-time post-infection protection. It provides security subscription, technical support, professional, and training services. It sells its security solutions to channel partners and directly to various customers in telecommunications, technology, government, financial services, education, retail, manufacturing, and healthcare industries. It has strategic alliance with Linksys. Fortinet, Inc. was incorporated in 2000 and is headquartered in Sunnyvale, California."
DXC,2.106002,5,2,1,0,1,1,"DXC Technology Company, together with its subsidiaries, provides information technology services and solutions primarily in North America, Europe, Asia, and Australia. It operates in two segments, Global Business Services (GBS) and Global Infrastructure Services (GIS). The GBS segment offers a portfolio of analytics services and extensive partner ecosystem that help its customers to gain rapid insights, automate operations, and accelerate their digital transformation journeys; and software engineering, consulting, and data analytics solutions that enable businesses to run and manage their mission-critical functions, transform their operations, and develop new ways of doing business. It also uses various technologies and methods to accelerate the creation, modernization, delivery, and maintenance of secure applications allowing customers to innovate faster while reducing risk, time to market, and total cost of ownership. In addition, this segment offers business process services, which include integration and optimization of front and back office processes, and agile process automation. The GIS segment adapts legacy apps to cloud, migrate the right workloads, and securely manage their multi-cloud environments; and offers security solutions help predict attacks, proactively respond to threats, and ensure compliance, as well as to protect data, applications, and infrastructure. It also provides IT outsourcing services to help customers securely and cost-effectively run mission-critical systems and IT infrastructure. In addition, this segment offers workplace services to fit its customer's employee, business, and IT needs from intelligent collaboration; and modern device management, digital support services, and mobility services. DXC Technology Company is headquartered in Ashburn, Virginia."
DBX,0.829916,4,2,1,1,-1,-1,"Dropbox, Inc. provides a content collaboration platform worldwide. Its platform allows individuals, families, teams, and organizations to collaborate and sign up for free through its website or app, as well as upgrade to a paid subscription plan for premium features. As of December 31, 2021, the company had approximately 700 million registered users. It serves customers in professional services, technology, media, education, industrial, consumer and retail, and financial services industries. The company was formerly known as Evenflow, Inc. and changed its name to Dropbox, Inc. in October 2009. Dropbox, Inc. was incorporated in 2007 and is headquartered in San Francisco, California."
MCRO,,0,-1,-1,-1,-1,-1,"The fund is a ""fund of funds"" which means it invests, under normal circumstances, at least 80% of its net assets, plus the amount of any borrowings for investment purposes, in the investments included in its underlying index, which includes underlying funds. The underlying index consists of a number of components (""underlying index Components"") selected in accordance with IndexIQ's rules-based methodology of such underlying index."
UTSI,0.957854,-1,0,2,0,2,0,"UTStarcom Holdings Corp. operates as a telecom infrastructure provider to develop technology for bandwidth from cloud-based services, mobile, streaming, and other applications in China, India, Japan, Taiwan, and internationally. The company's products include packet transport network, packet aggregation network, multi-services access network, fiber to the X, carrier Wi-Fi solutions, and software defined network controller products. It serves telecommunications and cable service providers. The company was founded in 1991 and is based in Hangzhou, the People's Republic of China."
507685,-1.0,-1,-1,-1,-1,-1,-1,-1
V,0.896977,-1,0,1,2,2,2,"Visa Inc. operates as a payments technology company worldwide. The company facilitates digital payments among consumers, merchants, financial institutions, businesses, strategic partners, and government entities. It operates VisaNet, a transaction processing network that enables authorization, clearing, and settlement of payment transactions. In addition, the company offers card products, platforms, and value-added services. It provides its services under the Visa, Visa Electron, Interlink, VPAY, and PLUS brands. Visa Inc. has a strategic agreement with Ooredoo to provide an enhanced payment experience for Visa cardholders and Ooredoo customers in Qatar. Visa Inc. was founded in 1958 and is headquartered in San Francisco, California."
532755,-1.0,-1,-1,-1,-1,-1,-1,-1
SGE,-1.0,-1,-1,-1,-1,-1,-1,-1
