,beta,score,forwardPE,currentRatio,profitMargin,debtToEquity,returnOnEquity,longBusinessSummary
SEIC,1.025968,10,2,2,2,2,2,"SEI Investments Company is a publicly owned asset management holding company. Through its subsidiaries, the firm provides wealth management, retirement and investment solutions, asset management, asset administration, investment processing outsourcing solutions, financial services, and investment advisory services to its clients. It provides its services to private banks, independent financial advisers, institutional investors, investment managers, investment advisors, wealth management organizations, corporations, retirement scheme sponsors, not-for-profit organizations, hedge fund managers, registered investment advisers, independent broker-dealers, financial planners, life insurance agents, defined-benefit schemes, defined-contribution schemes, endowments, foundations, and board-designated fund, through its subsidiaries. Through its subsidiaries, the firm manages separate client-focused portfolios. It also launches and manages equity, fixed income, and balanced mutual funds, through its subsidiaries. Through its subsidiaries, the firm invests in public equity and fixed income markets. It employs fundamental and quantitative analysis with a focus on top-down and bottom-up analysis to make its investments, through its subsidiaries. SEI Investments Company was founded in 1968 and is based in Oaks, Pennsylvania."
APAM,1.746275,9,2,1,2,2,2,"Artisan Partners Asset Management Inc. is publicly owned investment manager. It provides its services to pension and profit sharing plans, trusts, endowments, foundations, charitable organizations, government entities, private funds and non-U.S. funds, as well as mutual funds, non-U.S. funds and collective trusts. It manages separate client-focused equity and fixed income portfolios. The firm invests in the public equity and fixed income markets across the globe. It invests in growth and value stocks of companies across all market capitalization. For fixed income component of its portfolio the firm invests in non-investment grade corporate bonds and secured and unsecured loans. It employs fundamental analysis to create its portfolios. Artisan Partners Asset Management Inc. was founded in 1994 and is based in Milwaukee, Wisconsin with additional offices in Atlanta, Georgia; New York City; San Francisco, California; Leawood, Kansas; and London, United Kingdom."
BEN,1.185185,9,2,2,2,2,1,"Franklin Resources, Inc. is a publicly owned asset management holding company. Through its subsidiaries, the firm provides its services to individuals, institutions, pension plans, trusts, and partnerships. It launches equity, fixed income, balanced, and multi-asset mutual funds through its subsidiaries. The firm invests in the public equity, fixed income, and alternative markets. Franklin Resources, Inc. was founded in 1947 and is based in San Mateo, California with an additional office in Hyderabad, India."
TROW,1.338016,9,2,1,2,2,2,"T. Rowe Price Group, Inc. is a publicly owned investment manager. The firm provides its services to individuals, institutional investors, retirement plans, financial intermediaries, and institutions. It launches and manages equity and fixed income mutual funds. The firm invests in the public equity and fixed income markets across the globe. It employs fundamental and quantitative analysis with a bottom-up approach. The firm utilizes in-house and external research to make its investments. It employs socially responsible investing with a focus on environmental, social, and governance issues. It makes investment in late-stage venture capital transactions and usually invests between $3 million and $5 million. The firm was previously known as T. Rowe Group, Inc. and T. Rowe Price Associates, Inc. T. Rowe Price Group, Inc. was founded in 1937 and is based in Baltimore, Maryland, with additional offices in Colorado Springs, Colorado; Owings Mills, Maryland; San Francisco, California; New York, New York; Philadelphia, Pennsylvania; Tampa, Florida; Toronto, Ontario; Hellerup, Denmark; Amsterdam, The Netherlands; Luxembourg, Grand Duchy of Luxembourg; Zurich, Switzerland; Dubai, United Arab Emirates; London, United Kingdom; Sydney, New South Wales; Hong Kong; Tokyo, Japan; Singapore; Frankfurt, Germany, Madrid, Spain, Milan, Italy, Stockholm, Sweden, Melbourne, Australia, and Amsterdam, Netherlands."
LAZ,1.406555,8,2,2,1,1,2,"Lazard Ltd, together with its subsidiaries, operates as a financial advisory and asset management firm in North America, Europe, Asia, Australia, and Central and South America. It operates in two segments, Financial Advisory and Asset Management. The Financial Advisory segment offers various financial advisory services regarding mergers and acquisitions, restructurings, capital advisory, shareholder advisory, capital raising, sovereign advisory, and other strategic advisory matters. This segment serves corporate, partnership, institutional, government, sovereign, and individual clients across various industry areas, including consumers, financial institutions, healthcare and life sciences, industrials, power and energy/infrastructure, and real estate, as well as technology, telecommunication, and media and entertainment. The Asset Management segment offers a range of investment solutions, and investment and wealth management services in equity and fixed income strategies; asset allocation strategies; and alternative investments and private equity funds to corporations, public funds, sovereign entities, endowments and foundations, labor funds, financial intermediaries, and private clients. The company was founded in 1848 and is based in Hamilton, Bermuda."
ICE,0.902085,8,2,1,2,2,1,"Intercontinental Exchange, Inc., together with its subsidiaries, operates regulated exchanges, clearing houses, and listings venues for commodity, financial, fixed income, and equity markets in the United States, the United Kingdom, the European Union, Singapore, Israel, and Canada. It operates through three segments: Exchanges, Fixed Income and Data Services, and Mortgage Technology. The company operates marketplaces for listing, trading, and clearing an array of derivatives contracts and financial securities, such as commodities, interest rates, foreign exchange, and equities, as well as corporate and exchange-traded funds; trading venues, including 13 regulated exchanges and 6 clearing houses; and offers futures and options products for energy, agricultural and metals, financial, cash equities and equity, over-the-counter, and other markets, as well as listings and data and connectivity services. It also provides fixed income data and analytic, fixed income execution, CDS clearing, and other multi-asset class data and network services. In addition, the company offers proprietary and comprehensive mortgage origination platform, which serves residential mortgage loans; closing solutions that provides customers connectivity to the mortgage supply chain and facilitates the secure exchange of information; data and analytics services; and Data as a Service for lenders to access data and origination information. Intercontinental Exchange, Inc. was founded in 2000 and is headquartered in Atlanta, Georgia."
DFS,1.479352,8,2,1,2,1,2,"Discover Financial Services, through its subsidiaries, provides digital banking products and services, and payment services in the United States. It operates in two segments, Digital Banking and Payment Services. The Digital Banking segment offers Discover-branded credit cards to individuals; private student loans, personal loans, home loans, and other consumer lending; and direct-to-consumer deposit products comprising savings accounts, certificates of deposit, money market accounts, IRA certificates of deposit, IRA savings accounts and checking accounts, and sweep accounts. The Payment Services segment operates the PULSE, an automated teller machine, debit, and electronic funds transfer network; and Diners Club International, a payments network that issues Diners Club branded charge cards and/or provides card acceptance services, as well as offers payment transaction processing and settlement services. The company was incorporated in 1960 and is based in Riverwoods, Illinois."
BX,1.451681,8,1,1,2,2,2,"Blackstone Inc. is an alternative asset management firm specializing in real estate, private equity, hedge fund solutions, credit, secondary funds of funds, public debt and equity and multi-asset class strategies. The firm typically invests in early-stage companies. It also provide capital markets services. The real estate segment specializes in opportunistic, core+ investments as well as debt investment opportunities collateralized by commercial real estate, and stabilized income-oriented commercial real estate across North America, Europe and Asia. The firm's corporate private equity business pursues transactions throughout the world across a variety of transaction types, including large buyouts,special situations, distressed mortgage loans, mid-cap buyouts, buy and build platforms, which involves multiple acquisitions behind a single management team and platform, and growth equity/development projects involving significant majority stakes in portfolio companies and minority investments in operating companies, shipping, real estate, corporate or consumer loans, and alternative energy greenfield development projects in energy and power, property, dislocated markets, shipping opportunities, financial institution breakups, re-insurance, and improving freight mobility, financial services, healthcare, life sciences, enterprise tech and consumer, as well as consumer technologies. The fund considers investment in Asia and Latin America. It has a three year investment period. Its hedge fund business manages a broad range of commingled and customized fund solutions and its credit business focuses on loans, and securities of non-investment grade companies spread across the capital structure including senior debt, subordinated debt, preferred stock and common equity. Blackstone Inc. was founded in 1985 and is headquartered in New York, New York with additional offices across Asia, Europe and North America."
AXP,1.142613,7,2,1,1,1,2,"American Express Company, together with its subsidiaries, provides charge and credit payment card products, and travel-related services worldwide. The company operates through three segments: Global Consumer Services Group, Global Commercial Services, and Global Merchant and Network Services. Its products and services include payment and financing products; network services; accounts payable expense management products and services; and travel and lifestyle services. The company's products and services also comprise merchant acquisition and processing, servicing and settlement, point-of-sale marketing, and information products and services for merchants; and fraud prevention services, as well as the design and operation of customer loyalty programs. It sells its products and services to consumers, small businesses, mid-sized companies, and large corporations through mobile and online applications, third-party vendors and business partners, direct mail, telephone, in-house sales teams, and direct response advertising. American Express Company was founded in 1850 and is headquartered in New York, New York."
KKR,1.499787,7,2,1,1,2,1,"KKR & Co. Inc. is a private equity and real estate investment firm specializing in direct and fund of fund investments. It specializes in acquisitions, leveraged buyouts, management buyouts, credit special situations, growth equity, mature, mezzanine, distressed, turnaround, lower middle market and middle market investments. The firm considers investments in all industries with a focus on software, security, semiconductors, consumer electronics, internet of things (iot), internet, information services, information technology infrastructure, financial technology, network and cyber security architecture, engineering and operations, content, technology and hardware, energy and infrastructure, real estate, services industry with a focus on business services, intelligence, industry-leading franchises and companies in natural resource, containers and packaging, agriculture, airports, ports, forestry, electric utilities, textiles, apparel and luxury goods, household durables, digital media, insurance, brokerage houses, non-durable goods distribution, supermarket retailing, grocery stores, food, beverage, and tobacco, hospitals, entertainment venues and production companies, publishing, printing services, capital goods, financial services, specialized finance, pipelines, and renewable energy. In energy and infrastructure, it focuses on the upstream oil and gas and equipment, minerals and royalties and services verticals. In real estate, the firm seeks to invest in private and public real estate securities including property-level equity, debt and special situations transactions and businesses with significant real estate holdings, and oil and natural gas properties. The firm also invests in asset services sector that encompasses a broad array of B2B, B2C and B2G services verticals including asset-based, transport, logistics, leisure/hospitality, resource and utility support, infra-like, mission-critical, and environmental services. Within Americas, the firm prefers to invest in consumer products; chemicals, metals and mining; energy and natural resources; financial services; healthcare; industrials; media and communications; retail; and technology. Within Europe, the firm invests in consumer and retail; energy; financial services; health care; industrials and chemicals; media and digital; and telecom and technologies. Within Asia, it invests in consumer products; energy and resources; financial services; healthcare; industrials; logistics; media and telecom; retail; real estate; and technology. It also seeks to make impact investments focused on identifying and investing behind businesses with positive social or environmental impact. The firm seeks to invest in mid to high-end residential developments, but can invest in other projects throughout Mainland China through outright ownership, joint ventures, and merger. It invests globally with a focus on Australia, emerging and developed Asia, Middle East and Africa, Nordic, Southeast Asia, Asia Pacific, Ireland, Hong Kong, Japan, Taiwan, India, Vietnam, Malaysia, Singapore, Indonesia, France, Germany, Netherlands, United Kingdom, Caribbean, Mexico, South America, North America, Brazil, Latin America, Korea with a focus on South Korea, and United States of America. In the United States and Europe, the firm focuses on buyouts of large, publicly traded companies. It seeks to invest $30 million to $717 million in companies with enterprise values between $500 million to $2389 million. The firm prefers to invest in a range of debt and public equity investing and may co-invest. It seeks a board seat in its portfolio companies and a controlling ownership of a company or a strategic minority positions. The firm may acquire majority and minority equity interests, particularly when making private equity investments in Asia or sponsoring investments as part of a large investor consortium. The firm typically holds its investment for a period of five to seven years and more and exits through initial public offerings, secondary offerings, and sales to strategic buyers. KKR & Co. Inc. was founded in 1976 and is based in New York, New York with additional offices across North America, Europe, Australia, Sweden and Asia."
GS,1.38527,7,2,2,2,0,1,"The Goldman Sachs Group, Inc., a financial institution, provides a range of financial services for corporations, financial institutions, governments, and individuals worldwide. It operates through four segments: Investment Banking, Global Markets, Asset Management, and Consumer & Wealth Management. The company's Investment Banking segment provides financial advisory services, including strategic advisory assignments related to mergers and acquisitions, divestitures, corporate defense activities, restructurings, and spin-offs; and middle-market lending, relationship lending, and acquisition financing, as well as transaction banking services. This segment also offers underwriting services, such as equity underwriting for common and preferred stock and convertible and exchangeable securities; and debt underwriting for various types of debt instruments, including investment-grade and high-yield debt, bank and bridge loans, and emerging-and growth-market debt, as well as originates structured securities. Its Global Markets segment is involved in client execution activities for cash and derivative instruments; credit and interest rate products; and provision of equity intermediation and equity financing, clearing, settlement, and custody services, as well as mortgages, currencies, commodities, and equities related products. The company's Asset Management segment manages assets across various classes, including equity, fixed income, hedge funds, credit funds, private equity, real estate, currencies, and commodities; and provides customized investment advisory solutions, as well as invests in corporate, real estate, and infrastructure entities. Its Consumer & Wealth Management segment offers wealth advisory and banking services, including financial planning, investment management, deposit taking, and lending; private banking; and unsecured loans, as well as accepts saving and time deposits. The company was founded in 1869 and is headquartered in New York, New York."
BLK,1.26905,6,2,-1,2,2,-1,"BlackRock, Inc. is a publicly owned investment manager. The firm primarily provides its services to institutional, intermediary, and individual investors including corporate, public, union, and industry pension plans, insurance companies, third-party mutual funds, endowments, public institutions, governments, foundations, charities, sovereign wealth funds, corporations, official institutions, and banks. It also provides global risk management and advisory services. The firm manages separate client-focused equity, fixed income, and balanced portfolios. It also launches and manages open-end and closed-end mutual funds, offshore funds, unit trusts, and alternative investment vehicles including structured funds. The firm launches equity, fixed income, balanced, and real estate mutual funds. It also launches equity, fixed income, balanced, currency, commodity, and multi-asset exchange traded funds. The firm also launches and manages hedge funds. It invests in the public equity, fixed income, real estate, currency, commodity, and alternative markets across the globe. The firm primarily invests in growth and value stocks of small-cap, mid-cap, SMID-cap, large-cap, and multi-cap companies. It also invests in dividend-paying equity securities. The firm invests in investment grade municipal securities, government securities including securities issued or guaranteed by a government or a government agency or instrumentality, corporate bonds, and asset-backed and mortgage-backed securities. It employs fundamental and quantitative analysis with a focus on bottom-up and top-down approach to make its investments. The firm employs liquidity, asset allocation, balanced, real estate, and alternative strategies to make its investments. In real estate sector, it seeks to invest in Poland and Germany. The firm benchmarks the performance of its portfolios against various S&P, Russell, Barclays, MSCI, Citigroup, and Merrill Lynch indices. BlackRock, Inc. was founded in 1988 and is based in New York City with additional offices in Boston, Massachusetts; London, United Kingdom; Gurgaon, India; Hong Kong; Greenwich, Connecticut; Princeton, New Jersey; Edinburgh, United Kingdom; Sydney, Australia; Taipei, Taiwan; Singapore; Sao Paulo, Brazil; Philadelphia, Pennsylvania; Washington, District of Columbia; Toronto, Canada; Wilmington, Delaware; and San Francisco, California."
MCO,1.188165,6,1,1,2,0,2,"Moody's Corporation operates as an integrated risk assessment firm worldwide. It operates in two segments, Moody's Investors Service and Moody's Analytics. The Moody's Investors Service segment publishes credit ratings and provides assessment services on various debt obligations, programs and facilities, and entities that issue such obligations, such as various corporate, financial institution, and governmental obligations, as well as and structured finance securities. This segment provides ratings in approximately 140 countries. Its ratings are disseminated through press releases to the public through electronic media, including the internet and real-time information systems used by securities traders and investors. This segment has rated approximately 5,000 non-financial corporates; 3,600 financial institutions; 16,000 public finance issuers; 145 sovereigns; 47 supranational institutions; 459 sub-sovereigns; and 1,000 infrastructure and project finance issuers, as well as 9,100 structured finance deals. The Moody's Analytics segment develops a range of products and services that support the risk management activities of institutional participants in financial markets; and offers subscription based research, data, and analytical products comprising credit ratings, credit research, quantitative credit scores and other analytical tools, economic research and forecasts, business intelligence and company information products, commercial real estate data and analytical tools, and on-line and classroom-based training services, as well as credentialing and certification services. It also offers offshore analytical and research services with learning solutions and certification programs; and software solutions, as well as related risk management services. The company was formerly known as Dun and Bradstreet Company and changed its name to Moody's Corporation in September 2000. Moody's Corporation was founded in 1900 and is headquartered in New York, New York."
AFL,0.956577,6,2,0,1,2,1,"Aflac Incorporated, through its subsidiaries, provides supplemental health and life insurance products. It operates through two segments, Aflac Japan and Aflac U.S. The Aflac Japan segment offers cancer, medical, nursing care income support, GIFT, and whole and term life insurance products, as well as WAYS and child endowment plans under saving type insurance products in Japan. The Aflac U.S. segment provides cancer, accident, short-term disability, critical illness, hospital indemnity, dental, vision, long-term care and disability, and term and whole life insurance products in the United States. It sells its products through sales associates, brokers, independent corporate agencies, individual agencies, and affiliated corporate agencies. The company was founded in 1955 and is based in Columbus, Georgia."
BNS,0.895329,5,2,-1,2,-1,1,"The Bank of Nova Scotia provides various banking products and services in Canada, the United States, Mexico, Peru, Chile, Colombia, the Caribbean and Central America, and internationally. It operates in four segments: Canadian Banking, International Banking, Global Wealth Management, and Global Banking and Markets. The company offers financial advice and solutions, and day-to-day banking products, including debit and credit cards, chequing and saving accounts, investments, mortgages, loans, and insurance to individuals; and business banking solutions comprising lending, deposit, cash management, and trade finance solutions to small, medium, and large businesses, including automotive financing solutions to dealers and their customers. It also provides wealth management advice and solutions, including online brokerage, mobile investment, full-service brokerage, trust, private banking, and private investment counsel services; and retail mutual funds, exchange traded funds, liquid alternative funds, and institutional funds. In addition, the company offers international banking services for retail, corporate, and commercial customers; and lending and transaction, investment banking advisory, and capital markets access services to corporate customers. Further, it provides online, mobile, and telephone banking services. The company operates a network of 954 branches and approximately 3,766 automated banking machines in Canada; and approximately 1,300 branches and a network of contact and support center internationally. The Bank of Nova Scotia was founded in 1832 and is headquartered in Halifax, Canada."
