,beta,score,forwardPE,currentRatio,profitMargin,debtToEquity,returnOnEquity,longBusinessSummary
RF,1.299276,5,2,-1,2,-1,1,"Regions Financial Corporation, a financial holding company, provides banking and bank-related services to individual and corporate customers. It operates through three segments: Corporate Bank, Consumer Bank, and Wealth Management. The Corporate Bank segment offers commercial banking services, such as commercial and industrial, commercial real estate, and investor real estate lending; equipment lease financing; deposit products; and securities underwriting and placement, loan syndication and placement, foreign exchange, derivatives, merger and acquisition, and other advisory services. It serves corporate, middle market, and commercial real estate developers and investors. The Consumer Bank segment provides consumer banking products and services related to residential first mortgages, home equity lines and loans, consumer credit cards, and other consumer loans, as well as deposits. The Wealth Management segment offers credit related products, and retirement and savings solutions; and trust and investment management, asset management, and estate planning services to individuals, businesses, governmental institutions, and non-profit entities. The company also provides investment and insurance products; low-income housing tax credit corporate fund syndication services; and other specialty financing services. As of March 01, 2022, it operated through a network of 1,300 banking offices and 2,000 automated teller machines across the South, Midwest, and Texas. Regions Financial Corporation was founded in 1971 and is headquartered in Birmingham, Alabama."
OZK,1.475947,5,2,-1,2,-1,1,"Bank OZK provides various retail and commercial banking services. It accepts various deposit products, including non-interest-bearing checking, interest bearing transaction, business sweep, savings, money market, individual retirement, and other accounts, as well as time deposits. The company also offers real estate, consumer and business purpose, indirect recreational vehicle and marine, commercial and industrial, government guaranteed, agricultural, small business, homebuilder, and affordable housing loans; business aviation and subscription financing services; and mortgage and other lending products. In addition, it provides trust and wealth services, such as personal, custodial, investment management, and retirement accounts, as well as corporate trust services comprising trustee, paying and registered transfer agent, and other incidental services. Further, the company offers treasury management services comprising automated clearing house, wire transfer, transaction reporting, wholesale lockbox, remote deposit capture, automated credit line transfer, reconciliation, positive pay, and merchant and commercial card services, as well as zero balance and investment sweep accounts. Additionally, it provides ATMs; telephone, online, and mobile banking services; debit and credit cards; safe deposit boxes; and other products and services, as well as processes merchant debit and credit card transactions. As of December 31, 2021, it operated approximately 240 offices in Arkansas, Georgia, Florida, North Carolina, Texas, Carolina, California, New York, and Mississippi. The company was formerly known as Bank of the Ozarks and changed its name to Bank OZK in July 2018. Bank OZK was founded in 1903 and is headquartered in Little Rock, Arkansas."
UBS,1.205558,5,2,-1,2,-1,1,"UBS Group AG provides financial advice and solutions to private, institutional, and corporate clients worldwide. It operates through four divisions: Global Wealth Management, Personal & Corporate Banking, Asset Management, and Investment Bank. The Global Wealth Management division offers investment advice and solutions, and lending solutions to ultra high net worth and high net worth clients. This segment also provides estate and wealth planning, investing, philanthropy, corporate and banking, and family advisory services, as well as mortgage, securities-based, and structured lending solutions. The Personal & Corporate Banking division provides personal banking products and services, such as deposits, cards, and online and mobile banking, as well as lending, investments, and retirement services; and corporate and institutional solutions, including equity and debt capital markets, syndicated and structured credit, private placements, leasing, traditional financing, trade and export finance, and global custody solutions, as well as transaction banking solutions for payment and cash management. The Asset Management division offers equities, fixed income, hedge funds, real estate and private markets, indexed and alternative beta strategies, asset allocation and currency investment strategies, customized multi-asset solutions, advisory and fiduciary services, and multi-manager hedge fund solutions and advisory services. The Investment Bank division advises clients on strategic business opportunities and helps them raise capital to fund their activities; enables its clients to buy, sell, and finance securities on capital markets and to manage their risks and liquidity; and offers clients differentiated content on major financial markets and securities. The company was formerly known as UBS AG and changed its name to UBS Group AG in December 2014. UBS Group AG was founded in 1862 and is based in Zurich, Switzerland."
RY,0.77265,5,2,-1,2,-1,1,"Royal Bank of Canada operates as a diversified financial service company worldwide. The company's Personal & Commercial Banking segment offers checking and savings accounts, home equity financing, personal lending, private banking, indirect lending, including auto financing, mutual funds and self-directed brokerage accounts, guaranteed investment certificates, credit cards, and payment products and solutions; and lending, leasing, deposit, investment, foreign exchange, cash management, auto dealer financing, trade products, and services to small and medium-sized commercial businesses. This segment offers financial products and services through branches, automated teller machines, and mobile sales network. Its Wealth Management segment provides a suite of advice-based solutions and strategies to high net worth and ultra-high net worth individuals, and institutional clients. The company's Insurance segment offers life, health, home, auto, travel, wealth, annuities, and reinsurance advice and solutions; and business insurance services to individual, business, and group clients through its advice centers, RBC insurance stores, and mobile advisors; digital, mobile, and social platforms; independent brokers; and travel partners. Its Investor & Treasury Services segment provides asset servicing, custody, payments, and treasury services to financial and other investors; and fund and investment administration, shareholder, private capital, performance measurement and compliance monitoring, distribution, transaction banking, cash and liquidity management, foreign exchange, and global securities finance services. The company's Capital Markets segment offers corporate and investment banking, as well as equity and debt origination, distribution, advisory services, sale, and trading services for corporations, institutional investors, asset managers, private equity firms, and governments. The company was founded in 1864 and is headquartered in Toronto, Canada."
KEY,1.344827,5,2,-1,2,-1,1,"KeyCorp operates as the holding company for KeyBank National Association that provides various retail and commercial banking products and services in the United States. It operates in two segments, Consumer Bank and Commercial Bank. The company offers various deposits, investment products and services; and personal finance and financial wellness, student loan refinancing, mortgage and home equity, lending, credit card, treasury, business advisory, wealth management, asset management, investment, cash management, portfolio management, and trust and related services to individuals and small and medium-sized businesses. It also provides a suite of banking and capital market products, such as syndicated finance, debt and equity capital market products, commercial payments, equipment finance, commercial mortgage banking, derivatives, foreign exchange, financial advisory, and public finance, as well as commercial mortgage loans comprising consumer, energy, healthcare, industrial, public sector, real estate, and technology loans for middle market clients. In addition, the company offers community development financing, securities underwriting, brokerage, and investment banking services. As of December 31, 2021, it operated through a network of approximately 999 branches and 1,317 ATMs in 15 states, as well as additional offices, online and mobile banking capabilities, and a telephone banking call center. KeyCorp was founded in 1849 and is headquartered in Cleveland, Ohio."
JPM,1.144316,5,2,-1,2,-1,1,"JPMorgan Chase & Co. operates as a financial services company worldwide. It operates through four segments: Consumer & Community Banking (CCB), Corporate & Investment Bank (CIB), Commercial Banking (CB), and Asset & Wealth Management (AWM). The CCB segment offers s deposit, investment and lending products, payments, and services to consumers; lending, deposit, and cash management and payment solutions to small businesses; mortgage origination and servicing activities; residential mortgages and home equity loans; and credit card, auto loan, and leasing services. The CIB segment provides investment banking products and services, including corporate strategy and structure advisory, and equity and debt markets capital-raising services, as well as loan origination and syndication; payments and cross-border financing; and cash and derivative instruments, risk management solutions, prime brokerage, and research. This segment also offers securities services, including custody, fund accounting and administration, and securities lending products for asset managers, insurance companies, and public and private investment funds. The CB segment provides financial solutions, including lending, payments, investment banking, and asset management to small business, large and midsized companies, local governments, and nonprofit clients; and commercial real estate banking services to investors, developers, and owners of multifamily, office, retail, industrial, and affordable housing properties. The AWM segment offers multi-asset investment management solutions in equities, fixed income, alternatives, and money market funds to institutional clients and retail investors; and retirement products and services, brokerage, custody, trusts and estates, loans, mortgages, deposits, and investment management products. The company also provides ATM, online and mobile, and telephone banking services. JPMorgan Chase & Co. was founded in 1799 and is headquartered in New York, New York."
MS,1.407407,4,2,-1,2,0,-1,"Morgan Stanley, a financial holding company, provides various financial products and services to corporations, governments, financial institutions, and individuals in the Americas, Europe, the Middle East, Africa, and Asia. It operates through Institutional Securities, Wealth Management, and Investment Management segments. The Institutional Securities segment offers capital raising and financial advisory services, including services related to the underwriting of debt, equity, and other securities, as well as advice on mergers and acquisitions, restructurings, real estate, and project finance. This segment also provides sales and trading services, such as sales, financing, prime brokerage, and market-making services in equity and fixed income products consisting of foreign exchange and commodities; corporate and commercial real estate loans, which provides secured lending facilities and financing for sales and trading customers, and asset-backed and mortgage lending; and wealth management services, investment, and research services. The Wealth Management segment offers financial advisor-led brokerage and investment advisory services; self-directed brokerage services; financial and wealth planning services; workplace services, including stock plan administration; annuity and insurance products; securities-based lending, residential real estate loans, and other lending products; banking; and retirement plan services to individual investors and small to medium-sized businesses and institutions. The Investment Management segment provides equity, fixed income, liquidity, and alternative/other products to benefit/defined contribution plans, foundations, endowments, government entities, sovereign wealth funds, insurance companies, and third-party fund sponsors and corporations through institutional and intermediary channels. Morgan Stanley was founded in 1924 and is headquartered in New York, New York."
ONB,0.78842,4,2,-1,2,-1,0,"Old National Bancorp operates as the bank holding company for Old National Bank that provides various financial services to individual and commercial customers in the United States. It accepts deposit accounts, including noninterest-bearing demand, interest-bearing checking, negotiable order of withdrawal, savings and money market, and time deposits; and offers loans, such as home equity lines of credit, residential real estate loans, consumer loans, commercial loans, commercial real estate loans, letters of credit, and lease financing. The company also provides debit and automated teller machine cards, telephone access, online banking, and other electronic and mobile banking services; cash management, private banking, brokerage, trust, investment advisory, and other traditional banking services; wealth management, investment, and foreign currency services; and treasury management, merchant, health savings, and capital markets services, as well as community development lending and equity investment solutions. As of December 31, 2021, it operated a total of 162 banking centers located primarily in the states of Indiana, Kentucky, Michigan, Minnesota, and Wisconsin. Old National Bancorp was founded in 1834 and is headquartered in Evansville, Indiana."
GBCI,0.822477,4,2,-1,2,-1,0,"Glacier Bancorp, Inc. operates as the bank holding company for Glacier Bank that provides commercial banking services to individuals, small to medium-sized businesses, community organizations, and public entities in the United States. It offers non-interest bearing deposit and interest bearing deposit accounts, such as negotiable order of withdrawal and demand deposit accounts, savings accounts, money market deposit accounts, fixed rate certificates of deposit, negotiated-rate jumbo certificates, and individual retirement accounts. The company also provides construction and permanent loans on residential real estate; consumer land or lot acquisition loans; unimproved land and land development loans; and residential builder guidance lines comprising pre-sold and spec-home construction, and lot acquisition loans. In addition, it offers commercial real estate loans to purchase, construct, and finance commercial real estate properties; consumer loans secured by real estate, automobiles, or other assets; paycheck protection program loans; home equity loans consisting of junior lien mortgages, and first and junior lien lines of credit secured by owner-occupied 1-4 family residences; and agriculture loans. Further, the company provides mortgage origination and loan servicing services. It has 224 locations, including 188 branches and 36 loan or administration offices in 75 counties within 8 states comprising Montana, Idaho, Utah, Washington, Wyoming, Colorado, Arizona, and Nevada. The company was founded in 1955 and is headquartered in Kalispell, Montana."
C,1.607066,4,2,-1,2,-1,0,"Citigroup Inc., a diversified financial services holding company, provides various financial products and services to consumers, corporations, governments, and institutions in North America, Latin America, Asia, Europe, the Middle East, and Africa. The company operates in two segments, Global Consumer Banking (GCB) and Institutional Clients Group (ICG). The GCB segment offers traditional banking services to retail customers through retail banking, Citi-branded cards, and Citi retail services. It also provides various banking, credit card, lending, and investment services through a network of local branches, offices, and electronic delivery systems. The ICG segment offers wholesale banking products and services, including fixed income and equity sales and trading, foreign exchange, prime brokerage, derivative, equity and fixed income research, corporate lending, investment banking and advisory, private banking, cash management, trade finance, and securities services to corporate, institutional, public sector, and high-net-worth clients. As of December 31, 2020, it operated 2,303 branches primarily in the United States, Mexico, and Asia. Citigroup Inc. was founded in 1812 and is headquartered in New York, New York."
PNC,1.226053,4,2,-1,2,-1,0,"The PNC Financial Services Group, Inc. operates as a diversified financial services company in the United States. The company's Retail Banking segment offers checking, savings, and money market accounts, as well as certificates of deposit; residential mortgages, home equity loans and lines of credit, auto loans, credit cards, education loans, and personal and small business loans and lines of credit; and brokerage, insurance, and investment and cash management services. This segment serves consumer and small business customers through a network of branches, ATMs, call centers, and online and mobile banking channels. Its Corporate & Institutional Banking segment provides secured and unsecured loans, letters of credit, and equipment leases; cash and investment management services, receivables and disbursement management services, funds transfer services, international payment services, and access to online/mobile information management and reporting; foreign exchange, derivatives, fixed income, securities underwriting, loan syndications, and mergers and acquisitions and equity capital markets advisory related services; and commercial loan servicing and technology solutions. It serves mid-sized and large corporations, and government and not-for-profit entities. The company's Asset Management Group segment offers investment and retirement planning, customized investment management, credit and cash management solutions, and trust management and administration services for high net worth and ultra high net worth individuals, and their families; and multi-generational family planning services for ultra high net worth individuals and their families. It also provides outsourced chief investment officer, custody, private real estate, cash and fixed income client solutions, and fiduciary retirement advisory services for institutional clients. The company has 2,591 branches and 9,502 ATMs. The company was founded in 1852 and is headquartered in Pittsburgh, Pennsylvania."
WFC,1.165602,4,2,-1,2,-1,0,"Wells Fargo & Company, a diversified financial services company, provides banking, investment, mortgage, and consumer and commercial finance products and services in the United States and internationally. It operates through four segments: Consumer Banking and Lending; Commercial Banking; Corporate and Investment Banking; and Wealth and Investment Management. The Consumer Banking and Lending segment offers diversified financial products and services for consumers and small businesses. Its financial products and services include checking and savings accounts, and credit and debit cards, as well as home, auto, personal, and small business lending services. The Commercial Banking segment provides financial solutions to private, family owned, and certain public companies. Its products and services include banking and credit products across various industry sectors and municipalities, secured lending and lease products, and treasury management services. The Corporate and Investment Banking segment offers a suite of capital markets, banking, and financial products and services to corporate, commercial real estate, government, and institutional clients. Its products and services comprise corporate banking, investment banking, treasury management, commercial real estate lending and servicing, equity, and fixed income solutions, as well as sales, trading, and research capabilities services. The Wealth and Investment Management segment provides personalized wealth management, brokerage, financial planning, lending, private banking, and trust and fiduciary products and services to affluent, high-net worth, and ultra-high-net worth clients. It also operates through financial advisors. Wells Fargo & Company was founded in 1852 and is headquartered in San Francisco, California."
BAC,1.42401,4,2,-1,2,-1,0,"Bank of America Corporation, through its subsidiaries, provides banking and financial products and services for individual consumers, small and middle-market businesses, institutional investors, large corporations, and governments worldwide. Its Consumer Banking segment offers traditional and money market savings accounts, certificates of deposit and IRAs, noninterest-and interest-bearing checking accounts, and investment accounts and products; and credit and debit cards, residential mortgages, and home equity loans, as well as direct and indirect loans, such as automotive, recreational vehicle, and consumer personal loans. The company's Global Wealth & Investment Management segment offers investment management, brokerage, banking, and trust and retirement products and services; and wealth management solutions, as well as customized solutions, including specialty asset management services. Its Global Banking segment provides lending products and services, including commercial loans, leases, commitment facilities, trade finance, and commercial real estate and asset-based lending; treasury solutions, such as treasury management, foreign exchange, and short-term investing options and merchant services; working capital management solutions; and debt and equity underwriting and distribution, and merger-related and other advisory services. The company's Global Markets segment offers market-making, financing, securities clearing, settlement, and custody services, as well as risk management products using interest rate, equity, credit, currency and commodity derivatives, foreign exchange, fixed-income, and mortgage-related products. As of December 31, 2021, it served approximately 67 million consumer and small business clients with approximately 4,200 retail financial centers; approximately 16,000 ATMs; and digital banking platforms with approximately 41 million active users. The company was founded in 1784 and is based in Charlotte, North Carolina."
MTB,0.886334,4,2,-1,2,-1,0,"M&T Bank Corporation operates as a bank holding company that provides commercial and retail banking services. The company's Business Banking segment offers deposit, lending, cash management, and other financial services to small businesses and professionals. Its Commercial Banking segment provides deposit products, commercial lending and leasing, letters of credit, and cash management services for middle-market and large commercial customers. The company's Commercial Real Estate segment originates, sells, and services commercial real estate loans; and offers deposit services. Its Discretionary Portfolio segment provides deposits; securities, residential real estate loans, and other assets; and short and long term borrowed funds, as well as foreign exchange services. The company's Residential Mortgage Banking segment offers residential real estate loans for consumers and sells those loans in the secondary market; and purchases servicing rights to loans originated by other entities. Its Retail Banking segment offers demand, savings, and time accounts; consumer installment loans, automobile and recreational finance loans, home equity loans and lines of credit, and credit cards; mutual funds and annuities; and other services. The company also provides trust and wealth management; fiduciary and custodial; insurance agency; institutional brokerage and securities; and investment management services. It offers its services through banking offices, business banking centers, telephone and internet banking, and automated teller machines. As of December 31, 2021, the company operates 688 domestic banking offices in New York State, Maryland, New Jersey, Pennsylvania, Delaware, Connecticut, Virginia, West Virginia, and the District of Columbia; and a full-service commercial banking office in Ontario, Canada. M&T Bank Corporation was founded in 1856 and is headquartered in Buffalo, New York."
BCS,1.377096,4,2,-1,2,-1,0,"Barclays PLC, through its subsidiaries, provides various financial products and services in the United Kingdom, Europe, the Americas, Africa, the Middle East, and Asia. The company operates through Barclays UK and Barclays International divisions. It offers financial services, such as retail banking, credit cards, wholesale banking, investment banking, wealth management, and investment management services. The company also engages in securities dealing activities; and issues credit cards. The company was formerly known as Barclays Bank Limited and changed its name to Barclays PLC in January 1985. Barclays PLC was founded in 1690 and is headquartered in London, the United Kingdom."
